Starting Command: build_faultmodel 

INFO (TDA-005): Command Line Invocation: 
            build_faultmodel -includedynamic no -workdir /projects/2024H1230173P/projects/VTT_SAMM_mk2_RTLtoGDS_with_modus/test_scripts -stdout summary  [end TDA_005]

INFO (TDA-014): Cadence(R) Modus(TM) DFT Software Solution, Version 20.12-s002_1, built Feb 26 2021 (linux26_64) [end TDA_014]

INFO (TDA-015): Log File: /projects/2024H1230173P/projects/VTT_SAMM_mk2_RTLtoGDS_with_modus/test_scripts/testresults/logs/log_build_faultmodel_112925112249-778444000 [end TDA_015]

INFO (TDA-007): Job Information:
            Date Started: Saturday Nov 29 11:22:49 2025  IST
            Host machine is lenovo-51.pilani.bits-pilani.ac.in, x86_64 running Linux 3.10.0-1160.119.1.el7.x86_64.
            This job is process number 70005.
[end TDA_007]

INFO (TDA-009): Options/Values information.
            (options marked with '*' have program generated values,
             options marked with '+' were specified to default.)

            -WORKDIR /projects/2024H1230173P/projects/VTT_SAMM_mk2_RTLtoGDS_with_modus/test_scripts

            -LOGFILE /projects/2024H1230173P/projects/VTT_SAMM_mk2_RTLtoGDS_with_modus/test_scripts/testresults/logs/log_build_faultmodel_112925112249-778444000
            -STDOUT summary
            -includedynamic no
[end TDA_009]
INFO (TFW-117): Modus checked out a modus_atpg license.  [end TFW_117] 
INFO (TFM-099): Build Fault Model started.  [end TFM_099] 
INFO (TFM-102): Creating faultModel file /projects/2024H1230173P/projects/VTT_SAMM_mk2_RTLtoGDS_with_modus/test_scripts/tbdata/faultModel.  [end TFM_102] 

Global Ignored Static Fault Count               108
Global Ignored Dynamic Fault Count                0


                            Global Statistics

                    ATCov  ----------------------- Global Faults --------------------------
                   Global        Total       Tested     Possibly    Redundant     Untested

Total Static         0.00       138776            0            0            0       138776
Collapsed Static     0.00        89993            0            0            0        89993
PI Static            0.00           82            0            0            0           82
PO Static            0.00         2096            0            0            0         2096

Total Dynamic                        0

Parametric        

IDDq                 0.00       138776            0                                 138776



INFO (TFM-103): Creating faultStatus file /projects/2024H1230173P/projects/VTT_SAMM_mk2_RTLtoGDS_with_modus/test_scripts/tbdata/faultStatus.  [end TFM_103] 

                           Testmode Statistics: FULLSCAN

                 ---- ATCov ---- ------------------------ Testmode Faults ----------------------- ------------------------- Global Faults ------------------------
                 Testmode Global        Total       Tested     Possibly    Redundant     Untested        Total       Tested     Possibly    Redundant     Untested

Total Static         0.00   0.00       138776            0            0            0       138776       138776            0            0            0       138776
Collapsed Static     0.00   0.00        89993            0            0            0        89993        89993            0            0            0        89993
PI Static            0.00   0.00           82            0            0            0           82           82            0            0            0           82
PO Static            0.00   0.00         2096            0            0            0         2096         2096            0            0            0         2096

Total Dynamic                               0

Parametric        

IDDq                 0.00   0.00       138776            0                                 138776       138776            0                                 138776

Path                 0.00   0.00            0            0                                      0            0            0                                      0



INFO (TFM-704): Maximum Global Test Coverage Statistics: 

                  %Active      #Faults      #Active    #Inactive
Total Static       100.00       138776       138776            0
Collapsed Static   100.00        89993        89993            0
PI Static          100.00           82           82            0
PO Static          100.00         2096         2096            0

Total Dynamic                        0

Parametric        

There are 1 test mode(s) defined:
      FULLSCAN

[end TFM_704]
INFO (TFM-109): Build Fault Model has completed with highest level severity message of INFO.  [end TFM_109] 

INFO (TDA-001): Maximum Memory used during the run and Cumulative Time in hours:minutes:seconds:

                  Total Memory =           43,073,936  bytes

                      CPU Time =    0:00:00.10
                  Elapsed Time =    0:00:00.20                    [end TDA_001]

     Date Ended:  Saturday Nov 29 11:23:11 2025  IST

INFO (TFW-119): Modus checked in a modus_atpg license.  [end TFW_119] 



-------------------------------------------------------------------------------
*                      Message Summary                                        *
-------------------------------------------------------------------------------
 Count  Number             First Instance of Message Text
------- ------             ------------------------------

  INFO Messages...
      1 INFO (TFM-099): Build Fault Model started.   
      1 INFO (TFM-102): Creating faultModel file /projects/2024H1230173P/projects/VTT_SAMM_mk2_RTLtoGDS_with_modus/test_scripts/tbdata/faultModel.   
      1 INFO (TFM-103): Creating faultStatus file /projects/2024H1230173P/projects/VTT_SAMM_mk2_RTLtoGDS_with_modus/test_scripts/tbdata/faultStatus.   
      1 INFO (TFM-109): Build Fault Model has completed with highest level severity message of INFO.   
      1 INFO (TFM-704): Maximum Global Test Coverage Statistics: 
      1 INFO (TFW-117): Modus checked out a modus_atpg license.   
      1 INFO (TFW-119): Modus checked in a modus_atpg license.   

 For a detailed explanation of a message and a suggested user response execute 'msgHelp <message id>'.  For example: msgHelp TDA-009

-------------------------------------------------------------------------------
